{
  "$schema": "../schemas/plan-v4.schema.json",
  "schemaVersion": 4,
  "id": "service.wlms",
  "version": "3.0.0",
  "title": "禁用 Windows Licensing Monitoring Service",
  "description": "禁用 WLMS（Windows Server 授权监视服务）。可能影响 Server 激活状态监视、KMS/AD 续期以及 MAK/零售授权的后续宽限期处理；仅适用于不需要受支持授权状态管理的离线测试镜像。",
  "category": "Policies",
  "riskLevel": "High",
  "operations": [
    {
      "resource": "registry.service",
      "action": "configure",
      "spec": {
        "services": [
          "WLMS"
        ],
        "start": "disabled"
      }
    }
  ]
}
