{
  "$schema": "../schemas/plan-v5.schema.json",
  "schemaVersion": 4,
  "id": "feature.ad-certificate-services",
  "version": "3.0.0",
  "title": "移除 Active Directory 证书服务",
  "description": "移除 AD CS 证书颁发机构角色和管理工具；无法部署企业证书颁发机构。",
  "category": "Server Roles",
  "riskLevel": "High",
  "operations": [
    {
      "resource": "dism.feature",
      "action": "remove",
      "spec": {
        "features": [
          "ADCertificateServicesRole",
          "ADCertificateServicesManagementTools",
          "CertificateServices",
          "CertificateServicesManagementTools"
        ],
        "removePayload": true
      }
    }
  ]
}
