{
  "$schema": "../schemas/plan-v5.schema.json",
  "schemaVersion": 4,
  "id": "appx.gaming-app",
  "version": "3.0.0",
  "title": "移除 Xbox Gaming App",
  "description": "移除 Microsoft Gaming Appx。",
  "category": "Applications",
  "riskLevel": "Medium",
  "operations": [
    {
      "resource": "appx.provisioned",
      "action": "remove",
      "spec": {
        "patterns": [
          "Microsoft.GamingApp"
        ]
      }
    }
  ]
}
