{
  "$schema": "../schemas/plan-v4.schema.json",
  "schemaVersion": 4,
  "id": "appx.screen-sketch",
  "version": "3.0.0",
  "title": "移除截图工具 Appx",
  "description": "移除 Microsoft.ScreenSketch 预置 Appx；截图工具将不可用。",
  "category": "Applications",
  "riskLevel": "Low",
  "operations": [
    {
      "resource": "appx.provisioned",
      "action": "remove",
      "spec": {
        "patterns": [
          "Microsoft.ScreenSketch"
        ]
      }
    }
  ]
}
