{
  "$schema": "../schemas/plan-v5.schema.json",
  "schemaVersion": 4,
  "id": "appx.clipchamp",
  "version": "3.0.0",
  "title": "移除 Clipchamp",
  "description": "移除 Clipchamp 预装 Appx。",
  "category": "Applications",
  "riskLevel": "Low",
  "operations": [
    {
      "resource": "appx.provisioned",
      "action": "remove",
      "spec": {
        "patterns": [
          "Clipchamp.Clipchamp"
        ]
      }
    }
  ]
}
