{
  "$schema": "../schemas/plan-v4.schema.json",
  "schemaVersion": 4,
  "id": "capability.math-recognizer",
  "version": "3.0.0",
  "title": "移除数学识别能力",
  "description": "移除 Windows Ink 数学识别按需功能；不影响普通键盘输入、中文输入法或常规办公程序。",
  "category": "Utilities",
  "riskLevel": "Low",
  "operations": [
    {
      "resource": "dism.capability",
      "action": "remove",
      "spec": {
        "capabilities": [
          "MathRecognizer~~~~*"
        ]
      }
    }
  ]
}
