{
  "$schema": "../schemas/plan-v5.schema.json",
  "schemaVersion": 4,
  "id": "feature.data-deduplication",
  "version": "3.0.0",
  "title": "移除数据重复删除",
  "description": "移除 Data Deduplication 服务和 cmdlet；卷数据重复删除、优化和回收任务将不可用。",
  "category": "Storage",
  "riskLevel": "High",
  "operations": [
    {
      "resource": "dism.feature",
      "action": "remove",
      "spec": {
        "features": [
          "Dedup-Core"
        ],
        "removePayload": true
      }
    }
  ]
}
