{
  "$schema": "../schemas/plan-v4.schema.json",
  "schemaVersion": 4,
  "id": "feature.smb-direct",
  "version": "3.0.0",
  "title": "移除 SMB Direct",
  "description": "移除 RDMA 上的 SMB Direct；高速 RDMA 文件共享与 Storage Spaces Direct 工作负载会受影响。",
  "category": "Networking",
  "riskLevel": "High",
  "operations": [
    {
      "resource": "dism.feature",
      "action": "remove",
      "spec": {
        "features": [
          "SmbDirect"
        ],
        "removePayload": true
      }
    }
  ]
}
